{
  "stories": [
    {
      "slug": "mist-letters",
      "title": "霧林來信",
      "subtitle": "原創閱讀示範",
      "description": "一封沒有署名的信，帶領一名旅客走進不再遵守時間的森林。這篇原創短篇示範兩章，用來體驗網站的閱讀功能。",
      "category": "原創示範",
      "symbol": "✉",
      "palette": "teal",
      "status": "demo",
      "warnings": [],
      "chapters": [
        {
          "id": "01",
          "title": "第一章：最後一班車",
          "paragraphs": [
            "夜裡十一點，城郊最後一班列車停在了沒有站牌的月台。車門打開時，風把一封沒有署名的信送到了林的腳邊。",
            "信紙很薄，字跡卻像刻在木頭上的年輪：「別相信森林裡第一個叫出你名字的人。」",
            "林原本不打算下車。但車窗映著她的臉，也映著一個站在她身後、沒有影子的旅客。她抓起信，踏進濕冷的夜色。",
            "列車駛走時，月台上的鐘停止在十一點零一分。遠處有人輕輕喊了她的名字。"
          ]
        },
        {
          "id": "02",
          "title": "第二章：借來的名字",
          "paragraphs": [
            "森林裡的路不按照人的記憶延伸。林繞過同一棵銀色的樹三次，每一次都看見樹上多了一道刻痕。",
            "第四次經過時，一個披著舊雨衣的孩子坐在樹根旁，手裡拿著另外半封信。「你來得太晚了，」孩子說，「他們已經開始用你的名字開門。」",
            "林想詢問「他們」是誰，卻發現自己已想不起母親昨晚如何呼喚她。夜風翻開那半封信，最後一行寫著：「要走出這裡，先把真正的名字還給自己。」",
            "她抬頭時，孩子已不見蹤影。只剩前方的霧氣裡，亮起一盞溫暖得過分的燈。"
          ]
        }
      ],
      "cover": "assets/images/mist-letters.webp",
      "coverSmall": "assets/images/mist-letters-small.webp",
      "coverAlt": "月夜霧林裡的封蠟信件與遠方旅人，原創 AI 封面插畫",
      "coverTitle": "霧林來信",
      "coverSubtitle": "時間之外的森林",
      "coverSeries": "ORIGINAL FICTION"
    },
    {
      "slug": "dark-red-hood",
      "title": "紅帽：噬月森林",
      "subtitle": "完整黑暗奇幻長篇",
      "description": "二十五歲的伊芙琳重返噬月森林，追尋失蹤的母親、被奪走名字的孩子與黑暗魔法議會的祕密。完整原稿包含序章、十六章、終章及尾聲。",
      "category": "黑暗童話",
      "symbol": "☾",
      "palette": "red",
      "status": "complete",
      "warnings": [
        "殘酷暴力",
        "兒童受害與死亡",
        "成人情慾張力",
        "心理創傷與犧牲"
      ],
      "manuscript": "content/stories/dark-red-hood.md",
      "expectedChapters": 16,
      "expectedUnits": 19,
      "cover": "assets/images/dark-red-hood.webp",
      "coverSmall": "assets/images/dark-red-hood-small.webp",
      "coverAlt": "披緋紅斗篷的成年女子、蝕月與林間狼影，原創 AI 封面插畫",
      "coverTitle": "紅帽",
      "coverSubtitle": "噬月森林",
      "coverSeries": "DARK TALES · I"
    },
    {
      "slug": "dark-snow-white",
      "title": "白雪公主：血色魔鏡",
      "subtitle": "完整黑暗奇幻長篇",
      "description": "白雪在黑鐘學院、霜棘王國與血色魔鏡之間追查生命魔法的代價。完整內容包含序章、二十章及尾聲。",
      "category": "黑暗童話",
      "symbol": "♛",
      "palette": "rose",
      "status": "complete",
      "warnings": [
        "殘酷暴力",
        "兒童死亡與傷害",
        "階級壓迫",
        "成人情慾張力",
        "死亡與悲劇"
      ],
      "manuscript": "content/stories/dark-snow-white.md",
      "cover": "assets/images/snow-white-portrait.webp",
      "coverSmall": "assets/images/snow-white-portrait-small.webp",
      "coverAlt": "黑髮成年女子手持紅蘋果，身後是銀鏡與月夜城堡，原創 AI 封面插畫",
      "coverTitle": "白雪公主",
      "coverSubtitle": "血色魔鏡",
      "coverSeries": "DARK TALES · II"
    },
    {
      "slug": "dark-cinderella",
      "title": "灰燼王冠：午夜之後，無人倖免",
      "subtitle": "完整黑暗奇幻長篇",
      "description": "艾拉從灰燼與魔法血契的枷鎖中追尋母親遭處刑的真相，踏入白鐘、王室與午夜之後的革命。完整原稿包含序幕、十三章、終章及尾聲。",
      "category": "黑暗童話",
      "symbol": "✦",
      "palette": "blue",
      "status": "complete",
      "warnings": [
        "殘酷暴力",
        "奴役與權力剝削",
        "成人情慾張力",
        "死亡與悲劇"
      ],
      "manuscript": "content/stories/dark-cinderella.md",
      "expectedChapters": 13,
      "expectedUnits": 16,
      "cover": "assets/images/dark-cinderella.webp",
      "coverSmall": "assets/images/dark-cinderella-small.webp",
      "coverAlt": "成年女子手持焦黑金冠，站在灰燼覆蓋的午夜宮殿，原創 AI 封面插畫",
      "coverTitle": "灰燼王冠",
      "coverSubtitle": "午夜之後，無人倖免",
      "coverSeries": "DARK TALES · III"
    },
    {
      "slug": "dark-aladdin",
      "title": "阿拉丁：願望的屍骨",
      "subtitle": "完整黑暗奇幻長篇",
      "description": "神燈裡的願望需要陌生人付出生命；阿拉丁、茉莉與賈方捲入帝國的交易、奴役與魔法債務。完整原稿包含序章、十四章及終章。",
      "category": "黑暗童話",
      "symbol": "◇",
      "palette": "gold",
      "status": "complete",
      "warnings": [
        "殘酷暴力",
        "兒童剝削與傷害",
        "奴役",
        "成人情慾張力",
        "死亡與悲劇"
      ],
      "manuscript": "content/stories/dark-aladdin.md",
      "expectedChapters": 14,
      "expectedUnits": 16,
      "cover": "assets/images/dark-aladdin.webp",
      "coverSmall": "assets/images/dark-aladdin-small.webp",
      "coverAlt": "成年旅人手持古銅神燈，煙霧盤旋於月夜沙漠宮殿，原創 AI 封面插畫",
      "coverTitle": "阿拉丁",
      "coverSubtitle": "願望的屍骨",
      "coverSeries": "DARK TALES · IV"
    },
    {
      "slug": "dark-mermaid",
      "title": "小美人魚：沉默者的王冠",
      "subtitle": "完整黑暗奇幻長篇",
      "description": "人魚黎瑟追查被奪走歌聲的同胞，揭開七鐘塔、海底王廷與陸地權力背後的生命交易。完整原稿包含序章、十八章及終章。",
      "category": "黑暗童話",
      "symbol": "≈",
      "palette": "teal",
      "status": "complete",
      "warnings": [
        "殘酷暴力",
        "未成年人受害",
        "身體自主與剝削",
        "成人情慾張力",
        "戰爭與死亡"
      ],
      "manuscript": "content/stories/dark-mermaid.md",
      "expectedChapters": 18,
      "expectedUnits": 20,
      "cover": "assets/images/dark-mermaid.webp",
      "coverSmall": "assets/images/dark-mermaid-small.webp",
      "coverAlt": "身披鱗甲的成年人魚抱著古老王冠，坐於沉沒王廷，原創 AI 封面插畫",
      "coverTitle": "小美人魚",
      "coverSubtitle": "沉默者的王冠",
      "coverSeries": "DARK TALES · V"
    },
    {
      "slug": "dark-mulan",
      "title": "花木蘭：葬名之歌",
      "subtitle": "完整黑暗奇幻長篇",
      "description": "木蘭為了父親踏上戰場，卻發現皇朝以真名、死者與軍籍維繫永生的殘酷魔法。完整原稿包含序章、二十一章及尾聲。",
      "category": "黑暗奇幻",
      "symbol": "⚔",
      "palette": "red",
      "status": "complete",
      "warnings": [
        "戰爭殘酷暴力",
        "未成年人傷亡",
        "政治壓迫與奴役",
        "成人愛情",
        "死亡與悲劇"
      ],
      "manuscript": "content/stories/dark-mulan.md",
      "expectedChapters": 21,
      "expectedUnits": 23,
      "cover": "assets/images/dark-mulan.webp",
      "coverSmall": "assets/images/dark-mulan-small.webp",
      "coverAlt": "身披玄鐵鎧甲的成年女戰士、舊軍籍木牌與霧中城門，原創 AI 封面插畫",
      "coverTitle": "花木蘭",
      "coverSubtitle": "葬名之歌",
      "coverSeries": "DARK FANTASY · VI"
    }
  ],
  "tools": [
    {
      "title": "多語翻譯工具",
      "description": "選擇多個目標語言，比較與複製翻譯結果。",
      "category": "文字與資料",
      "symbol": "globe",
      "href": "https://lucas-tools.owl3918.workers.dev/tools/translation-tool",
      "trait": "需要網路"
    },
    {
      "title": "圖片轉 WebP",
      "description": "在瀏覽器批次轉換與壓縮圖片。",
      "category": "圖片設計",
      "symbol": "imageSwap",
      "href": "https://lucas-tools.owl3918.workers.dev/tools/convert-to-webp",
      "trait": "本機處理"
    },
    {
      "title": "資料格式轉換器",
      "description": "JSON、YAML、CSV 等常見格式轉換。",
      "category": "開發工具",
      "symbol": "braces",
      "href": "https://lucas-tools.owl3918.workers.dev/tools/format-converter",
      "trait": "本機處理"
    },
    {
      "title": "時間轉換",
      "description": "Unix 時戳與不同時區日期時間換算。",
      "category": "開發工具",
      "symbol": "clock",
      "href": "https://lucas-tools.owl3918.workers.dev/tools/time-converter",
      "trait": "本機處理"
    },
    {
      "title": "PDF 工具箱",
      "description": "合併、擷取、旋轉與重新排列 PDF 頁面。",
      "category": "文字與資料",
      "symbol": "file",
      "href": "https://lucas-tools.owl3918.workers.dev/tools/pdf-toolbox",
      "trait": "本機處理"
    },
    {
      "title": "色彩工具箱",
      "description": "取得色彩值並轉換 HEX、RGB、HSL 等格式。",
      "category": "圖片設計",
      "symbol": "palette",
      "href": "https://lucas-tools.owl3918.workers.dev/tools/color-picker",
      "trait": "本機處理"
    },
    {
      "title": "台灣即時電力看板",
      "description": "查看台灣用電、發電結構及供電餘裕。",
      "category": "生活資訊",
      "symbol": "bolt",
      "href": "https://lucas-tools.owl3918.workers.dev/tools/power-grid",
      "trait": "需要網路"
    },
    {
      "title": "QR Code 產生器",
      "description": "在瀏覽器本機產生可下載的 QR Code。",
      "category": "生活資訊",
      "symbol": "qr",
      "href": "https://lucas-tools.owl3918.workers.dev/tools/qr-code",
      "trait": "本機處理"
    }
  ],
  "games": [
    {
      "slug": "blood-mirror",
      "title": "白雪公主：血色魔鏡",
      "description": "化身白雪，探索五座被詛咒的密室，蒐集道具、解開生命契約，決定三種結局。支援手機與桌面，提供提示、線索筆記與本機自動存檔。",
      "category": "恐怖密室逃脫",
      "status": "playable",
      "symbol": "mirror",
      "palette": "rose",
      "storySlug": "dark-snow-white",
      "duration": "約 25–40 分鐘",
      "warnings": [
        "心理恐怖",
        "死亡與生命剝削",
        "兒童受害敘事"
      ],
      "cover": "assets/images/snow-white-portrait.webp",
      "coverSmall": "assets/images/snow-white-portrait-small.webp",
      "coverAlt": "黑髮公主手持血紅蘋果，身後是魔鏡與月夜城堡",
      "coverTitle": "白雪公主",
      "coverSubtitle": "血色魔鏡",
      "coverSeries": "ESCAPE ROOM · PLAYABLE",
      "highlights": [
        "七幕連續探索與謎題",
        "道具、線索筆記與分層提示",
        "三種可回看的結局",
        "桌面、觸控與鍵盤操作",
        "僅此瀏覽器自動存檔，沒有時間限制"
      ]
    },
    {
      "slug": "mist-trail",
      "title": "霧林迷途",
      "description": "以選擇影響劇情分支的網頁冒險概念；目前尚未開發可遊玩版本。",
      "category": "互動敘事",
      "status": "concept",
      "symbol": "lantern",
      "palette": "teal"
    },
    {
      "slug": "rune-room",
      "title": "符文密室",
      "description": "觀察符文與場景中的線索，逐步破解關卡的遊戲概念。",
      "category": "解謎遊戲",
      "status": "concept",
      "symbol": "rune",
      "palette": "rose"
    }
  ],
  "projects": [
    {
      "slug": "lucas-tools",
      "title": "Lucas Tools",
      "description": "使用 Vue 3、TypeScript、Vite 開發的工具集合。本站僅展示並連回原網站，不搬移程式碼。",
      "category": "Web Application",
      "status": "live",
      "symbol": "toolbox",
      "palette": "blue",
      "href": "https://lucas-tools.owl3918.workers.dev/",
      "repo": "https://github.com/LucasLu3918/lucas-tools",
      "highlights": [
        "Vue 3 + TypeScript + Vite",
        "多用途工具分類",
        "前端本機運算與資料查詢"
      ]
    },
    {
      "slug": "aips",
      "title": "AI Product System",
      "description": "以人類決策為中心的 AI 輔助產品開發系統，涵蓋治理、流程與工程品質。",
      "category": "AI Engineering",
      "status": "repo",
      "symbol": "aips",
      "palette": "rose",
      "href": "https://lucaslu3918.github.io/ai-product-system/",
      "repo": "https://github.com/LucasLu3918/ai-product-system",
      "highlights": [
        "AI 協作流程",
        "品質檢查與治理",